"TABLE 2. SPECIES RANKED IN DESCENDING ORDER OF TOTAL FY2010 REPORTED EXPENDITURES, NOT INCLUDING LAND ACQUISITION COSTS",Unnamed: 1,Unnamed: 2,Unnamed: 3,Unnamed: 4,Unnamed: 5,Unnamed: 6,Unnamed: 7,Unnamed: 8,Unnamed: 9,Unnamed: 10,Unnamed: 11,Unnamed: 12,Unnamed: 13,Unnamed: 14
Rank,Rank,Species (50 CFR Part 17),Species (50 CFR Part 17),Status,Status,,Species,,,Cumulatative,,,,
,,,,,,,,,Total,Total,,,,
1,"Salmon, chinook (Oncorhynchus (=Salmo) tshawytscha) - spring/summer Snake R.",T,"$51,062,511","$51,062,511",,,,,,,,,,
,2,,,Steelhead (Oncorhynchus (=Salmo) mykiss) - middle Columbia R.,,,T,,,"$48,065,029",,,"99,127,540",
3,Steelhead (Oncorhynchus (=Salmo) mykiss) - Snake R. Basin,T,"$45,834,199","$144,961,739",,,,,,,,,,
,4,,,"Trout, bull (Salvelinus confluentus) - U.S.A., conterminous, lower 48 states",,,T,,,"$43,809,838",,,"188,771,577",
5,"Salmon, chinook (Oncorhynchus (=Salmo) tshawytscha) - winter Sacramento R.",E,"$40,814,218","$229,585,795",,,,,,,,,,
,6,,,"Salmon, chinook (Oncorhynchus (=Salmo) tshawytscha) - fall Snake R.",,,T,,,"$33,938,220",,,"263,524,015",
7,"Salmon, chinook (Oncorhynchus (=Salmo) tshawytscha) - spring upper Columbia R.",E,"$30,304,423","$293,828,438",,,,,,,,,,
,8,,,Steelhead (Oncorhynchus (=Salmo) mykiss) - upper Columbia R. Basin,,,T,,,"$29,151,942",,,"322,980,380",
9,"Woodpecker, red-cockaded (Picoides borealis)",E,"$25,194,067","$348,174,447",,,,,,,,,,
,10,,,"Salmon, chinook (Oncorhynchus (=Salmo) tshawytscha) - lower Columbia R.",,,T,,,"$23,392,671",,,"371,567,118",
11,"Sturgeon, pallid (Scaphirhynchus albus)",E,"$22,696,252","$394,263,370",,,,,,,,,,
,12,,,"Salmon, coho (Oncorhynchus (=Salmo) kisutch) - OR, CA pop.",,,T,,,"$19,572,047",,,"413,835,417",
13,"Salmon, chinook (Oncorhynchus (=Salmo) tshawytscha) - upper Willamette R.",T,"$19,410,149","$433,245,566",,,,,,,,,,
,14,,,Steelhead (Oncorhynchus (=Salmo) mykiss) - lower Columbia R.,,,T,,,"$18,002,939",,,"451,248,505",
15,"Salmon, sockeye (Oncorhynchus (=Salmo) nerka) - U.S.A. (Snake River, ID stockwherever found.)",E,"$17,235,935","$468,484,440",,,,,,,,,,
,16,,,"Sea-lion, Steller (Eumetopias jubatus) - western pop.",,,E,,,"$16,679,395",,,"485,163,835",
17,"Sea-lion, Steller (Eumetopias jubatus) - eastern pop.",T,"$16,568,504","$501,732,339",,,,,,,,,,
,18,,,"Tortoise, desert (Gopherus agassizii) - U.S.A., except in Sonoran Desert",,,T,,,"$16,343,561",,,"518,075,900",
19,Steelhead (Oncorhynchus (=Salmo) mykiss) - upper Willamette R.,T,"$16,330,291","$534,406,191",,,,,,,,,,
,20,,,"Salmon, chinook (Oncorhynchus (=Salmo) tshawytscha) - Puget Sound",,,T,,,"$14,595,229",,,"549,001,420",
21,"Owl, northern spotted (Strix occidentalis caurina)",T,"$14,086,571","$563,087,991",,,,,,,,,,
,22,,,"Whale, right (Balaena glacialis (incl. australis))",,,E,,,"$13,596,253",,,"576,684,244",
23,"Salmon, Atlantic (Salmo salar) - Expanded Gulf of Maine DPS",E,"$13,145,296","$589,829,540",,,,,,,,,,
,24,,,"Salmon, chum (Oncorhynchus (=Salmo) keta) - Columbia R.",,,T,,,"$12,826,943",,,"602,656,483",
25,"Salmon, coho (Oncorhynchus (=Salmo) kisutch) - Lower Columbia River ESU",T,"$12,150,709","$614,807,192",,,,,,,,,,
,26,,,"Salmon, chinook (Oncorhynchus (=Salmo) tshawytscha) - CA Central Valley spring-run",,,T,,,"$12,075,507",,,"626,882,699",
27,"Sea turtle, loggerhead (Caretta caretta)",T,"$11,285,625","$638,168,324",,,,,,,,,,
,28,,,"Plover, piping (Charadrius melodus) - except Great Lakes watershed",,,T,,,"$11,235,785",,,"649,404,109",
29,"Minnow, Rio Grande silvery (Hybognathus amarus) - Rio Grande, from Little BoxCanyon to Amistad Dam",EXPN,"$10,857,819","$660,261,928",,,,,,,,,,
,30,,,"Flycatcher, southwestern willow (Empidonax traillii extimus)",,,E,,,"$10,579,072",,,"670,841,000",
31,"Manatee, West Indian (Trichechus manatus)",E,"$10,353,294","$681,194,294",,,,,,,,,,
,32,,,Steelhead (Oncorhynchus (=Salmo) mykiss) - Central Valley CA,,,T,,,"$9,886,506",,,"691,080,800",
33,"Tern, least (Sterna antillarum) - interior pop.",E,"$9,614,921","$700,695,721",,,,,,,,,,
34,34,,"Bear, grizzly (Ursus arctos horribilis) - lower 48 States, except where listed as an",,T,T,"$8,781,280","$8,781,280","$709,477,001","709,477,001",,,,
,,,,experimental population or delisted,,,,,,,,,,
35,"Sucker, razorback (Xyrauchen texanus) - entire",E,"$8,089,950","$717,566,951",,,,,,,,,,
,36,,,"Whale, humpback (Megaptera novaeangliae)",,,E,,,"$7,921,457",,,"725,488,408",
37,"Sturgeon, white (Acipenser transmontanus) - U.S.A. (ID, MT), Canada (B.C.), KootenaiR. system",E,"$7,768,332","$733,256,740",,,,,,,,,,
,38,,,"Tern, California least (Sterna antillarum browni)",,,E,,,"$7,463,329",,,"740,720,069",
39,"Sucker, Santa Ana (Catostomus santaanae) - 3 CA river basins",T,"$7,437,464","$748,157,533",,,,,,,,,,
,40,,,Steelhead (Oncorhynchus (=Salmo) mykiss) - Puget Sound DPS,,,T,,,"$7,273,083",,,"755,430,616",
41,"Sea turtle, leatherback (Dermochelys coriacea)",E,"$7,057,501","$762,488,117",,,,,,,,,,
42,42,,"Wolf, gray (Canis lupus) - Lower 48 States, except MN, MT, ID, portions of eastern OR,",,E,E,"$6,954,633","$6,954,633","$769,442,750","769,442,750",,,,
,,,,"eastern WA, north-central UT, and where EXPN. Mexico.",,,,,,,,,,
43,"Vireo, least Bell's (Vireo bellii pusillus)",E,"$6,925,553","$776,368,303",,,,,,,,,,
,44,,,"Bear, polar (Ursus maritimus)",,,T,,,"$6,804,746",,,"783,173,049",
45,"Bat, Indiana (Myotis sodalis)",E,"$6,742,846","$789,915,895",,,,,,,,,,
,46,,,"Sea turtle, hawksbill (Eretmochelys imbricata)",,,E,,,"$6,598,089",,,"796,513,984",
47,Steelhead (Oncorhynchus (=Salmo) mykiss) - southern CA coast,E,"$6,593,274","$803,107,258",,,,,,,,,,
,48,,,"Murrelet, marbled (Brachyramphus marmoratus) - CA, OR, WA",,,T,,,"$6,173,301",,,"809,280,559",
49,"Salmon, coho (Oncorhynchus (=Salmo) kisutch) - Central California Coast ESU",E,"$5,873,786","$815,154,345",,,,,,,,,,
,50,,,"Pronghorn, Sonoran (Antilocapra americana sonoriensis)",,,E,,,"$5,827,743",,,"820,982,088",
51,"Salmon, chum (Oncorhynchus (=Salmo) keta) - summer-run Hood Canal",T,"$5,736,015","$826,718,103",,,,,,,,,,
,52,,,"Sea turtle, green (Chelonia mydas) - except where endangered",,,T,,,"$5,662,140",,,"832,380,243",
Rank,Rank,,,,,,,,,,,,,
Species (50 CFR Part 17),Species (50 CFR Part 17),,,,,,,,,,,,,
Status,Status,,,,,,,,,,,,,
34,34,,,,,,,,,,,,,
T,T,,,,,,,,,,,,,
"$8,781,280","$8,781,280",,,,,,,,,,,,,
"$709,477,001","709,477,001",,,,,,,,,,,,,
42,42,,,,,,,,,,,,,
E,E,,,,,,,,,,,,,
"$6,954,633","$6,954,633",,,,,,,,,,,,,
"$769,442,750","769,442,750",,,,,,,,,,,,,
,53,,,"Seal, Hawaiian monk (Monachus schauinslandi)",,,E,,,"$5,650,652",,,"838,030,895",
54,"Salmon, sockeye (Oncorhynchus (=Salmo) nerka) - U.S.A. (Ozette Lake, WA)",T,"$5,299,383","$843,330,278",,,,,,,,,,
,55,,,Steelhead (Oncorhynchus (=Salmo) mykiss) - northern CA,,,T,,,"$5,136,439",,,"848,466,717",
56,"Sea turtle, Kemp's ridley (Lepidochelys kempii)",E,"$5,130,707","$853,597,424",,,,,,,,,,
,57,,,"Chub, humpback (Gila cypha) - entire",,,E,,,"$4,907,675",,,"858,505,099",
58,Steelhead (Oncorhynchus (=Salmo) mykiss) - south central CA coast,T,"$4,819,733","$863,324,832",,,,,,,,,,
,59,,,"Plover, western snowy (Charadrius alexandrinus nivosus) - Pacific coastal pop.",,,T,,,"$4,697,911",,,"868,022,743",
60,"Salmon, chinook (Oncorhynchus (=Salmo) tshawytscha) - CA coastal",T,"$4,675,133","$872,697,876",,,,,,,,,,
,61,,,Steelhead (Oncorhynchus (=Salmo) mykiss) - central CA coast,,,T,,,"$4,636,177",,,"877,334,053",
62,"Sturgeon, shortnose (Acipenser brevirostrum)",E,"$4,569,131","$881,903,184",,,,,,,,,,
,63,,,"Whale, sperm (Physeter catodon (=macrocephalus))",,,E,,,"$4,432,830",,,"886,336,014",
64,"Trout, Lahontan cutthroat (Oncorhynchus clarki henshawi)",T,"$4,280,684","$890,616,698",,,,,,,,,,
,65,,,"Chub, bonytail (Gila elegans) - entire",,,E,,,"$4,236,525",,,"894,853,223",
66,"Whale, blue (Balaenoptera musculus)",E,"$4,198,058","$899,051,281",,,,,,,,,,
,67,,,"Lynx, Canada (Lynx canadensis) - Contiguous U.S. DPS",,,T,,,"$4,191,798",,,"903,243,079",
68,"Whale, Sei (Balaenoptera borealis)",E,"$4,147,048","$907,390,127",,,,,,,,,,
,69,,,"scrub-jay, Florida (Aphelocoma coerulescens)",,,T,,,"$3,997,085",,,"911,387,212",
70,"Whale, finback (Balaenoptera physalus)",E,"$3,814,423","$915,201,635",,,,,,,,,,
,71,,,"Sturgeon, North American green (Acipenser medirostris) - CA -Southern DPS",,,T,,,"$3,658,452",,,"918,860,087",
72,"Tortoise, gopher (Gopherus polyphemus) - W of of Mobile/Tombigbee Rs.",T,"$3,588,732","$922,448,819",,,,,,,,,,
73,73,,"Pikeminnow (=squawfish), Colorado (Ptychocheilus lucius) - except Salt and Verde R.",,E,E,"$3,573,523","$3,573,523","$926,022,342","926,022,342",,,,
,,,,"drainages, AZ",,,,,,,,,,
74,"Snake, giant garter (Thamnophis gigas)",T,"$3,490,313","$929,512,655",,,,,,,,,,
,75,,,"Eider, Steller's (Polysticta stelleri) - AK breeding pop.",,,T,,,"$2,834,912",,,"932,347,567",
76,"Whale, bowhead (Balaena mysticetus)",E,"$2,821,352","$935,168,919",,,,,,,,,,
,77,,,"Ladies'-tresses, Ute (Spiranthes diluvialis)",,,T,,,"$2,789,999",,,"937,958,918",
78,"Smelt, delta (Hypomesus transpacificus)",T,"$2,784,587","$940,743,505",,,,,,,,,,
,79,,,"Frog, California red-legged (Rana draytonii) - Entire",,,T,,,"$2,732,668",,,"943,476,173",
80,"Owl, Mexican spotted (Strix occidentalis lucida)",T,"$2,602,947","$946,079,120",,,,,,,,,,
,81,,,"Sucker, Lost River (Deltistes luxatus)",,,E,,,"$2,577,801",,,"948,656,921",
82,"Whale, killer (Orcinus orca) - Southern Resident DPS",E,"$2,569,693","$951,226,614",,,,,,,,,,
,83,,,"Coral, staghorn (Acropora cervicornis)",,,T,,,"$2,560,317",,,"953,786,931",
84,"Sucker, shortnose (Chasmistes brevirostris)",E,"$2,499,067","$956,285,998",,,,,,,,,,
,85,,,"Beetle, valley elderberry longhorn (Desmocerus californicus dimorphus)",,,T,,,"$2,495,323",,,"958,781,321",
86,"Snake, eastern indigo (Drymarchon corais couperi)",T,"$2,460,953","$961,242,274",,,,,,,,,,
,87,,,"Coral, elkhorn (Acropora palmata)",,,T,,,"$2,460,760",,,"963,703,034",
88,"Sturgeon, gulf (Acipenser oxyrinchus desotoi)",T,"$2,320,107","$966,023,141",,,,,,,,,,
,89,,,"Shrike, San Clemente loggerhead (Lanius ludovicianus mearnsi)",,,E,,,"$2,251,896",,,"968,275,037",
90,"Crane, whooping (Grus americana) - CO, ID, FL, NM, UT, and western WY",EXPN,"$2,240,579","$970,515,616",,,,,,,,,,
,91,,,"Salamander, California tiger (Ambystoma californiense) - CA - Sonoma County",,,E,,,"$2,207,619",,,"972,723,235",
92,"Stork, wood (Mycteria americana) - AL, FL, GA, SC",E,"$2,006,896","$974,730,131",,,,,,,,,,
,93,,,"Fairy shrimp, vernal pool (Branchinecta lynchi)",,,T,,,"$1,978,888",,,"976,709,019",
94,"Bear, Louisiana black (Ursus americanus luteolus)",T,"$1,915,352","$978,624,371",,,,,,,,,,
,95,,,"Parrot, Puerto Rican (Amazona vittata)",,,E,,,"$1,915,235",,,"980,539,606",
96,"Bear, grizzly (Ursus arctos horribilis) - EXPN, non-essential portions of ID and MT",EXPN,"$1,899,104","$982,438,710",,,,,,,,,,
,97,,,"Goldfields, Contra Costa (Lasthenia conjugens)",,,E,,,"$1,855,592",,,"984,294,302",
98,"Wolf, gray (Canis lupus) - WY, ID, MT",EXPN,"$1,829,149","$986,123,451",,,,,,,,,,
,99,,,"Warbler (=wood), golden-cheeked (Dendroica chrysoparia)",,,E,,,"$1,740,019",,,"987,863,470",
100,"Butterfly, Karner blue (Lycaeides melissa samuelis)",E,"$1,729,106","$989,592,576",,,,,,,,,,
,101,,,Palila (honeycreeper) (Loxioides bailleui),,,E,,,"$1,720,585",,,"991,313,161",
102,"Prairie dog, Utah (Cynomys parvidens)",T,"$1,720,072","$993,033,233",,,,,,,,,,
,103,,,"Rail, Yuma clapper (Rallus longirostris yumanensis) - U.S.A. only",,,E,,,"$1,676,931",,,"994,710,164",
104,"Wolf, Mexican gray (Canis lupus baileyi) - portions of AZ, NM and TX",EXPN,"$1,628,931","$996,339,095",,,,,,,,,,
,105,,,"Condor, California (Gymnogyps californianus) - U.S.A. only",,,E,,,"$1,601,115",,,"997,940,210",
106,"Toad, arroyo (=arroyo southwestern) (Bufo californicus (=microscaphus))",E,"$1,576,429","$999,516,639",,,,,,,,,,
,107,,,"Wolf, gray (Canis lupus) - MN",,,T,,,"$1,560,262",,,"1,001,076,901",
108,"Sawfish, smalltooth (Pristis pectinata)",E,"$1,555,876","$1,002,632,777",,,,,,,,,,
,109,,,"Fox, San Joaquin kit (Vulpes macrotis mutica)",,,E,,,"$1,528,053",,,"1,004,160,830",
110,"Darter, Okaloosa (Etheostoma okaloosae)",E,"$1,506,235","$1,005,667,065",,,,,,,,,,
73,73,,,,,,,,,,,,,
E,E,,,,,,,,,,,,,
"$3,573,523","$3,573,523",,,,,,,,,,,,,
"$926,022,342","926,022,342",,,,,,,,,,,,,
,,,,,,,,,,Total,Total,,,
111,"Panther, Florida (Puma (=Felis) concolor coryi)",E,"$1,488,530","$1,007,155,595",,,,,,,,,,
,112,,,"Bat, lesser long-nosed (Leptonycteris curasoae yerbabuenae)",,,E,,,"$1,476,106",,,"1,008,631,701",
113,"Alligator, American (Alligator mississippiensis)",SAT,"$1,446,653","$1,010,078,354",,,,,,,,,,
114,114,,"Crane, whooping (Grus americana) - AL, AR, GA, IL, IN, IA, KY, LA, MI, MN, MS,",,EXPN,EXPN,"$1,443,841","$1,443,841","$1,011,522,195","1,011,522,195",,,,
,,,,"MO, NC, OH, SC, TN, VA, WI, WV",,,,,,,,,,
115,"Seagrass, Johnson's (Halophila johnsonii)",T,"$1,443,585","$1,012,965,780",,,,,,,,,,
,116,,,"Salamander, California tiger (Ambystoma californiense) - Central CA DPS",,,T,,,"$1,392,458",,,"1,014,358,238",
117,"Falcon, northern aplomado (Falco femoralis septentrionalis)",E,"$1,349,143","$1,015,707,381",,,,,,,,,,
,118,,,"Ferret, black-footed (Mustela nigripes) - entire population, except where EXPN",,,E,,,"$1,331,395",,,"1,017,038,776",
119,"Trout, Apache (Oncorhynchus apache)",T,"$1,296,316","$1,018,335,092",,,,,,,,,,
,120,,,"Sea turtle, green (Chelonia mydas) - FL, Mexico nesting pops.",,,E,,,"$1,277,944",,,"1,019,613,036",
121,"Abalone, White (Haliotis sorenseni) - North America (West Coast from PointConception, CA,  to Punta Abreojos, Baja California, Mexico)",E,"$1,239,899","$1,020,852,935",,,,,,,,,,
,122,,,"Sea turtle, olive ridley (Lepidochelys olivacea) - except where endangered",,,T,,,"$1,188,296",,,"1,022,041,231",
123,"Goose, Hawaiian (Branta (=Nesochen) sandvicensis)",E,"$1,176,121","$1,023,217,352",,,,,,,,,,
,124,,,"Frog, Chiricahua leopard (Rana chiricahuensis)",,,T,,,"$1,152,117",,,"1,024,369,469",
125,"Chub, Oregon (Oregonichthys crameri)",T,"$1,151,629","$1,025,521,098",,,,,,,,,,
,126,,,"Eider, spectacled (Somateria fischeri)",,,T,,,"$1,133,700",,,"1,026,654,798",
127,"Vireo, black-capped (Vireo atricapilla)",E,"$1,127,323","$1,027,782,121",,,,,,,,,,
,128,,,"Minnow, Rio Grande silvery (Hybognathus amarus) - Entire, except where EXPN",,,E,,,"$1,118,382",,,"1,028,900,503",
129,"Crane, whooping (Grus americana) - except where EXPN",E,"$1,111,844","$1,030,012,347",,,,,,,,,,
,130,,,"Bat, gray (Myotis grisescens)",,,E,,,"$1,108,571",,,"1,031,120,918",
131,"Tadpole shrimp, vernal pool (Lepidurus packardi)",E,"$1,093,686","$1,032,214,604",,,,,,,,,,
,132,,,"Turtle, bog (=Muhlenberg) (Clemmys muhlenbergii) - northern",,,T,,,"$1,090,253",,,"1,033,304,857",
133,"Rabbit, riparian brush (Sylvilagus bachmani riparius)",E,"$1,064,178","$1,034,369,035",,,,,,,,,,
,134,,,"Parrotbill, Maui (honeycreeper) (Pseudonestor xanthophrys)",,,E,,,"$1,063,600",,,"1,035,432,635",
135,"Trout, Gila (Oncorhynchus gilae)",T,"$1,062,750","$1,036,495,385",,,,,,,,,,
,136,,,"Warbler, Kirtland's (Dendroica kirtlandii)",,,E,,,"$1,038,371",,,"1,037,533,756",
137,"Amaranth, seabeach (Amaranthus pumilus)",T,"$1,035,827","$1,038,569,583",,,,,,,,,,
,138,,,"Rail, California clapper (Rallus longirostris obsoletus)",,,E,,,"$1,014,226",,,"1,039,583,809",
139,"Otter, southern sea (Enhydra lutris nereis) - except where EXPN",T,"$1,013,882","$1,040,597,691",,,,,,,,,,
,140,,,"Salamander, California tiger (Ambystoma californiense) - CA - Santa Barbara County",,,E,,,"$1,002,956",,,"1,041,600,647",
141,Higgins eye (pearlymussel) (Lampsilis higginsii),E,"$998,903","$1,042,599,550",,,,,,,,,,
,142,,,"Kite, Everglade snail (Rostrhamus sociabilis plumbeus) - FL pop.",,,E,,,"$982,944",,,"1,043,582,494",
143,"Sucker, June (Chasmistes liorus)",E,"$934,700","$1,044,517,194",,,,,,,,,,
,144,,,"Cactus, Siler pincushion (Pediocactus (=Echinocactus,=Utahia) sileri)",,,T,,,"$928,400",,,"1,045,445,594",
145,"Ferret, black-footed (Mustela nigripes) -  portions of AZ, CO, MT, SD, UT, WY",EXPN,"$924,640","$1,046,370,234",,,,,,,,,,
,146,,,Cui-ui (Chasmistes cujus),,,E,,,"$912,593",,,"1,047,282,827",
147,"Wolf, red (Canis rufus) - portions of NC and TN",EXPN,"$895,500","$1,048,178,327",,,,,,,,,,
,148,,,"Plover, piping (Charadrius melodus) - Great Lakes watershed",,,E,,,"$882,742",,,"1,049,061,069",
149,"Gnatcatcher, coastal California (Polioptila californica californica)",T,"$877,449","$1,049,938,518",,,,,,,,,,
,150,,,"Butterfly, Oregon silverspot (Speyeria zerene hippolyta)",,,T,,,"$875,444",,,"1,050,813,962",
151,"Crow, Mariana (=aga) (Corvus kubaryi)",E,"$873,803","$1,051,687,765",,,,,,,,,,
,152,,,"Crow, Hawaiian (='alala) (Corvus hawaiiensis)",,,E,,,"$841,199",,,"1,052,528,964",
153,"Wolf, gray (Canis lupus) - Mexican gray wolf, EXPN population",EXPN,"$831,844","$1,053,360,808",,,,,,,,,,
,154,,,"Minnow, loach (Tiaroga cobitis)",,,T,,,"$829,547",,,"1,054,190,355",
155,"Mucket, pink (pearlymussel) (Lampsilis abrupta)",E,"$820,394","$1,055,010,749",,,,,,,,,,
,156,,,"Water-umbel, Huachuca (Lilaeopsis schaffneriana var. recurva)",,,E,,,"$808,674",,,"1,055,819,423",
157,"Topminnow, Gila (incl. Yaqui) (Poeciliopsis occidentalis) - U.S.A. only",E,"$758,544","$1,056,577,967",,,,,,,,,,
,158,,,"Mouse, salt marsh harvest (Reithrodontomys raviventris)",,,E,,,"$755,358",,,"1,057,333,325",
159,"Eagle, bald (Haliaeetus leucocephalus) - Sonoran Desert DPS",T,"$746,240","$1,058,079,565",,,,,,,,,,
,160,,,Spikedace (Meda fulgida),,,T,,,"$733,174",,,"1,058,812,739",
161,"Woundfin (Plagopterus argentissimus) - except Gila R. drainage, AZ, NM",E,"$729,904","$1,059,542,643",,,,,,,,,,
,162,,,"Sparrow, Cape Sable seaside (Ammodramus maritimus mirabilis)",,,E,,,"$710,781",,,"1,060,253,424",
163,"Shiner, Pecos bluntnose (Notropis simus pecosensis)",T,"$701,900","$1,060,955,324",,,,,,,,,,
,164,,,"Condor, California (Gymnogyps californianus) - specific portions of AZ, NV, and UT",,,EXPN,,,"$698,300",,,"1,061,653,624",
165,"Snails, Oahu tree (Achatinella spp.)",E,"$685,801","$1,062,339,425",,,,,,,,,,
,166,,,Ocelot (Leopardus (=Felis) pardalis),,,E,,,"$684,535",,,"1,063,023,960",
167,"Peppergrass, Slickspot (Lepidium papilliferum)",T,"$674,205","$1,063,698,165",,,,,,,,,,
114,114,,,,,,,,,,,,,
EXPN,EXPN,,,,,,,,,,,,,
"$1,443,841","$1,443,841",,,,,,,,,,,,,
"$1,011,522,195","1,011,522,195",,,,,,,,,,,,,
,,,,,,,,,,Total,Total,,,
168.0,"Sparrow, Florida grasshopper (Ammodramus savannarum floridanus)",E,"$673,972","$1,064,372,137",,,,,,,,,,
,169,,,"Goby, tidewater (Eucyclogobius newberryi) - Entire",,,E,,,"$662,572",,,"1,065,034,709",
170.0,"Pupfish, Devils Hole (Cyprinodon diabolis)",E,"$655,739","$1,065,690,448",,,,,,,,,,
,171,,,"Darter, fountain (Etheostoma fonticola)",,,E,,,"$655,364",,,"1,066,345,812",
172.0,"Dace, Moapa (Moapa coriacea)",E,"$640,246","$1,066,986,058",,,,,,,,,,
,173,,,"Paintbrush, golden (Castilleja levisecta)",,,T,,,"$639,981",,,"1,067,626,039",
174.0,"Beetle, American burying (Nicrophorus americanus)",E,"$639,848","$1,068,265,887",,,,,,,,,,
,175,,,"Elktoe, Appalachian (Alasmidonta raveneliana)",,,E,,,"$637,938",,,"1,068,903,825",
176.0,"Butterfly, Fender's blue (Icaricia icarioides fenderi)",E,"$612,642","$1,069,516,467",,,,,,,,,,
,177,,,"Rabbit, pygmy (Brachylagus idahoensis) - Columbia Basin DPS",,,E,,,"$607,493",,,"1,070,123,960",
178.0,"Deer, Columbian white-tailed (Odocoileus virginianus leucurus) - Columbia River DPS",E,"$590,728","$1,070,714,688",,,,,,,,,,
,179,,,"Elepaio, Oahu (Chasiempis sandwichensis ibidis)",,,E,,,"$588,974",,,"1,071,303,662",
180.0,"Wedgemussel, dwarf (Alasmidonta heterodon)",E,"$582,082","$1,071,885,744",,,,,,,,,,
,181,,,"Chub, Gila (Gila intermedia)",,,E,,,"$573,655",,,"1,072,459,399",
182.0,"Jaguarundi, Gulf Coast (Herpailurus (=Felis) yagouaroundi cacomitli)",E,"$565,185","$1,073,024,584",,,,,,,,,,
,183,,,"Whipsnake (=striped racer), Alameda (Masticophis lateralis euryxanthus)",,,T,,,"$556,599",,,"1,073,581,183",
184.0,"Butterfly, Quino checkerspot (Euphydryas editha quino (=E. e. wrighti))",E,"$555,403","$1,074,136,586",,,,,,,,,,
,185,,,"Lizard, blunt-nosed leopard (Gambelia silus)",,,E,,,"$554,882",,,"1,074,691,468",
186.0,"Kangaroo rat, giant (Dipodomys ingens)",E,"$545,725","$1,075,237,193",,,,,,,,,,
,187,,,"Bat, Hawaiian hoary (Lasiurus cinereus semotus)",,,E,,,"$544,557",,,"1,075,781,750",
188.0,"Darter, Niangua (Etheostoma nianguae)",T,"$534,983","$1,076,316,733",,,,,,,,,,
,189,,,"Brodiaea, thread-leaved (Brodiaea filifolia)",,,T,,,"$526,858",,,"1,076,843,591",
190.0,"Butterfly, El Segundo blue (Euphilotes battoides allyni)",E,"$525,715","$1,077,369,306",,,,,,,,,,
,191,,,Geocarpon minimum (=Sci name),,,T,,,"$514,400",,,"1,077,883,706",
192.0,"Mouse, Pacific pocket (Perognathus longimembris pacificus)",E,"$504,427","$1,078,388,133",,,,,,,,,,
,193,,,"Sea turtle, olive ridley (Lepidochelys olivacea) - Mexican nesting pop.",,,E,,,"$504,064",,,"1,078,892,197",
194.0,"Chub, Virgin River (Gila seminuda (=robusta))",E,"$503,783","$1,079,395,980",,,,,,,,,,
,195,,,"Fritillary, Gentner's (Fritillaria gentneri)",,,E,,,"$492,250",,,"1,079,888,230",
196.0,"Sparrow, San Clemente sage (Amphispiza belli clementeae)",T,"$487,731","$1,080,375,961",,,,,,,,,,
,197,,,"Petrel, Hawaiian dark-rumped (Pterodroma phaeopygia sandwichensis)",,,E,,,"$487,451",,,"1,080,863,412",
198.0,Pondberry (Lindera melissifolia),E,"$486,365","$1,081,349,777",,,,,,,,,,
,199,,,"Kangaroo rat, San Bernardino Merriam's (Dipodomys merriami parvus)",,,E,,,"$480,917",,,"1,081,830,694",
200.0,"Fairy shrimp, San Diego (Branchinecta sandiegonensis)",E,"$475,338","$1,082,306,032",,,,,,,,,,
,201,,,"Lupine, Kincaid's (Lupinus sulphureus (=oreganus) ssp. kincaidii (=var. kincaidii))",,,T,,,"$469,969",,,"1,082,776,001",
202.0,"Pearlshell, Louisiana (Margaritifera hembeli)",T,"$466,356","$1,083,242,357",,,,,,,,,,
,203,,,"Riffleshell, northern (Epioblasma torulosa rangiana)",,,E,,,"$465,925",,,"1,083,708,282",
204.0,"Catchfly, Spalding's (Silene spaldingii)",T,"$465,676","$1,084,173,958",,,,,,,,,,
,205,,,"Shearwater, Newell's Townsend's (Puffinus auricularis newelli)",,,T,,,"$465,165",,,"1,084,639,123",
206.0,"Bat, Mariana fruit (=Mariana flying fox) (Pteropus mariannus mariannus) - entire",T,"$463,223","$1,085,102,346",,,,,,,,,,
,207,,,"Navarretia, spreading (Navarretia fossalis)",,,T,,,"$458,018",,,"1,085,560,364",
208.0,Clubshell (Pleurobema clava) - Entire Range; Except where EXPN,E,"$456,402","$1,086,016,766",,,,,,,,,,
,209,,,"Squirrel, northern Idaho ground (Spermophilus brunneus brunneus)",,,T,,,"$453,197",,,"1,086,469,963",
210.0,"Frog, Mississippi gopher (Rana capito sevosa) - west of Mobile and Tombigbee Riversin AL, MS, and LA",E,"$446,383","$1,086,916,346",,,,,,,,,,
,211,,,Abutilon sandwicense (=Sci name),,,E,,,"$441,396",,,"1,087,357,742",
212.0,"Sheep, Sierra Nevada bighorn (Ovis canadensis sierrae) - Sierra Nevada",E,"$436,479","$1,087,794,221",,,,,,,,,,
,213,,,"Stilt, Hawaiian (Himantopus mexicanus knudseni)",,,E,,,"$432,573",,,"1,088,226,794",
214.0,"Mapleleaf, winged (Quadrula fragosa) - Entire; except where EXPN",E,"$422,411","$1,088,649,205",,,,,,,,,,
,215,,,"Shiner, Topeka (Notropis topeka (=tristis))",,,E,,,"$418,937",,,"1,089,068,142",
216.0,"Snail, flat-spired three-toothed (Triodopsis platysayoides)",T,"$417,698","$1,089,485,840",,,,,,,,,,
,217,,,"Tortoise, desert (Gopherus agassizii) - outside/taken from Sonoran Desert",,,SAT,,,"$403,924",,,"1,089,889,764",
218.0,"Duck, Hawaiian (=koloa) (Anas wyvilliana)",E,"$403,642","$1,090,293,406",,,,,,,,,,
,219,,,"Logperch, Roanoke (Percina rex)",,,E,,,"$401,343",,,"1,090,694,749",
220.0,"Wartyback, white (pearlymussel) (Plethobasus cicatricosus)",E,"$388,020","$1,091,082,769",,,,,,,,,,
,221,,,"Darter, boulder (Etheostoma wapiti)",,,E,,,"$386,569",,,"1,091,469,338",
222.0,"Tern, roseate (Sterna dougallii dougallii) - northeast U.S. nesting pop.",E,"$382,867","$1,091,852,205",,,,,,,,,,
,223,,,"Otter, Northern Sea (Enhydra lutris kenyoni) - southwest Alaska DPS",,,T,,,"$373,842",,,"1,092,226,047",
224.0,"Snake, San Francisco garter (Thamnophis sirtalis tetrataenia)",E,"$373,770","$1,092,599,817",,,,,,,,,,
,225,,,"Spinymussel, James (Pleurobema collina)",,,E,,,"$368,450",,,"1,092,968,267",
,226,,,"Rail, light-footed clapper (Rallus longirostris levipes) - U.S.A. only",,,E,,,"$366,105",,,"1,093,334,372",
227.0,"Pocketbook, fat (Potamilus capax)",E,"$358,740","$1,093,693,112",,,,,,,,,,
,228,,,"Mouse, Preble's meadow jumping (Zapus hudsonius preblei) -  north-central CO",,,T,,,"$353,863",,,"1,094,046,975",
229.0,"Curlew, Eskimo (Numenius borealis)",E,"$350,090","$1,094,397,065",,,,,,,,,,
,230,,,"Snail, Bliss Rapids (Taylorconcha serpenticola)",,,T,,,"$344,939",,,"1,094,742,004",
231.0,"Pupfish, desert (Cyprinodon macularius)",E,"$338,085","$1,095,080,089",,,,,,,,,,
,232,,,"salamander, Reticulated flatwoods (Ambystoma bishopi)",,,E,,,"$335,914",,,"1,095,416,003",
233.0,"Rail, Guam (Rallus owstoni) - except Rota",E,"$335,200","$1,095,751,203",,,,,,,,,,
,234,,,"Wild-rice, Texas (Zizania texana)",,,E,,,"$333,502",,,"1,096,084,705",
235.0,"Milk-vetch, Lane Mountain (Astragalus jaegerianus)",E,"$332,493","$1,096,417,198",,,,,,,,,,
,236,,,"Fox, Santa Rosa Island (Urocyon littoralis santarosae)",,,E,,,"$332,167",,,"1,096,749,365",
237.0,"Mouse, Perdido Key beach (Peromyscus polionotus trissyllepsis)",E,"$328,448","$1,097,077,813",,,,,,,,,,
,238,,,"Lily, Western (Lilium occidentale)",,,E,,,"$326,715",,,"1,097,404,528",
239.0,"Bat, Ozark big-eared (Corynorhinus (=Plecotus) townsendii ingens)",E,"$316,420","$1,097,720,948",,,,,,,,,,
,240,,,"Stickleback, unarmored threespine (Gasterosteus aculeatus williamsoni)",,,E,,,"$314,351",,,"1,098,035,299",
