657.0,Akiapola`au (honeycreeper) (Hemignathus munroi),E,"$45,605","$1,154,024,526",,,,,,,,,,
,658,,,"Toad, Puerto Rican crested (Peltophryne lemur)",,,T,,,"$45,500",,,"1,154,070,026",
659.0,"Manzanita, pallid (Arctostaphylos pallida)",T,"$45,378","$1,154,115,404",,,,,,,,,,
,660,,,"Jewelflower, California (Caulanthus californicus)",,,E,,,"$44,650",,,"1,154,160,054",
661.0,"Madtom, yellowfin (Noturus flavipinnis) - except where EXPN",T,"$44,400","$1,154,204,454",,,,,,,,,,
,662,,,"Pocketbook, finelined (Lampsilis altilis)",,,T,,,"$44,137",,,"1,154,248,591",
663.0,Sandlace (Polygonella myriophylla),E,"$44,090","$1,154,292,681",,,,,,,,,,
,664,,,"Salamander, Texas blind (Typhlomolge rathbuni)",,,E,,,"$44,040",,,"1,154,336,721",
665.0,"Thornmint, San Mateo (Acanthomintha obovata ssp. duttonii)",E,"$43,998","$1,154,380,719",,,,,,,,,,
,666,,,"Meshweaver, Braken Bat Cave (Cicurina venii)",,,E,,,"$43,600",,,"1,154,424,319",
667.0,"Isopod, Lee County cave (Lirceus usdagalun)",E,"$43,500","$1,154,467,819",,,,,,,,,,
,668,,,"Skipper, Laguna Mountains (Pyrgus ruralis lagunae)",,,E,,,"$43,366",,,"1,154,511,185",
669.0,"Duck, Laysan (Anas laysanensis)",E,"$43,253","$1,154,554,438",,,,,,,,,,
,670,,,"Harebells, Avon Park (Crotalaria avonensis)",,,E,,,"$42,850",,,"1,154,597,288",
671.0,"Arrowhead, bunched (Sagittaria fasciculata)",E,"$42,228","$1,154,639,516",,,,,,,,,,
,672,,,"Rhododendron, Chapman (Rhododendron chapmanii)",,,E,,,"$41,951",,,"1,154,681,467",
,673,,,Puma (=mountain lion) (Puma (=Felis) concolor (all subsp. except coryi)) - FL,,,SAT,,,"$41,661",,,"1,154,723,128",
674.0,"Rabbitsfoot, rough (Quadrula cylindrica strigillata)",E,"$41,599","$1,154,764,727",,,,,,,,,,
,675,,,"Lousewort, Furbish (Pedicularis furbishiae)",,,E,,,"$41,363",,,"1,154,806,090",
676.0,"Snail, Virginia fringed mountain (Polygyriscus virginianus)",E,"$41,100","$1,154,847,190",,,,,,,,,,
,677,,,"Sandwort, Cumberland (Arenaria cumberlandensis)",,,E,,,"$40,207",,,"1,154,887,397",
678.0,"Monkshood, northern wild (Aconitum noveboracense)",T,"$40,025","$1,154,927,422",,,,,,,,,,
,679,,,"Turtle, flattened musk (Sternotherus depressus) - species range clarified",,,T,,,"$39,865",,,"1,154,967,287",
680.0,`Oha wai (Clermontia lindseyana),E,"$39,441","$1,155,006,728",,,,,,,,,,
,681,,,"Puma (=cougar), eastern (Puma (=Felis) concolor couguar)",,,E,,,"$39,295",,,"1,155,046,023",
682.0,"Wallflower, Contra Costa (Erysimum capitatum var. angustatum)",E,"$39,205","$1,155,085,228",,,,,,,,,,
,683,,,"Skipper, Pawnee montane (Hesperia leonardus montana)",,,T,,,"$39,079",,,"1,155,124,307",
684.0,"Lessingia, San Francisco (Lessingia germanorum (=L.g. var. germanorum))",E,"$39,011","$1,155,163,318",,,,,,,,,,
,685,,,"Evening-primrose, Eureka Valley (Oenothera avita ssp. eurekensis)",,,E,,,"$38,978",,,"1,155,202,296",
686.0,Ha`iwale (Cyrtandra giffardii),E,"$38,804","$1,155,241,100",,,,,,,,,,
,687,,,Nukupu`u (honeycreeper) (Hemignathus lucidus),,,E,,,"$38,700",,,"1,155,279,800",
688.0,"Akepa, Maui (honeycreeper) (Loxops coccineus ochraceus)",E,"$38,600","$1,155,318,400",,,,,,,,,,
,689,,,"Pawpaw, four-petal (Asimina tetramera)",,,E,,,"$38,375",,,"1,155,356,775",
690.0,"Rock-cress, Braun's (Arabis perstellata)",E,"$38,113","$1,155,394,888",,,,,,,,,,
,691,,,"Riversnail, Anthony's (Athearnia anthonyi) – Entire; Except where EXPN",,,E,,,"$37,920",,,"1,155,432,808",
692.0,"Lizard, Island night (Xantusia riversiana)",T,"$37,859","$1,155,470,667",,,,,,,,,,
,693,,,"Wallflower, Menzies' (Erysimum menziesii)",,,E,,,"$37,500",,,"1,155,508,167",
693.0,"Aster, Ruth's golden (Pityopsis ruthii)",E,"$37,500","$1,155,545,667",,,,,,,,,,
,694,,,"Milk-vetch, Jesup's (Astragalus robbinsii var. jesupi)",,,E,,,"$37,350",,,"1,155,583,017",
695.0,"Cactus, San Rafael (Pediocactus despainii)",E,"$37,325","$1,155,620,342",,,,,,,,,,
,696,,,"Madtom, smoky (Noturus baileyi) - Entire",,,E,,,"$36,900",,,"1,155,657,242",
697.0,"Cactus, Winkler (Pediocactus winkleri)",T,"$36,550","$1,155,693,792",,,,,,,,,,
,698,,,"Blazingstar, scrub (Liatris ohlingerae)",,,E,,,"$36,100",,,"1,155,729,892",
699.0,"Clubshell, ovate (Pleurobema perovatum)",E,"$35,872","$1,155,765,764",,,,,,,,,,
,700,,,"Cactus, Tobusch fishhook (Ancistrocactus tobuschii)",,,E,,,"$35,650",,,"1,155,801,414",
701.0,"Snail, Chittenango ovate amber (Succinea chittenangoensis)",T,"$35,431","$1,155,836,845",,,,,,,,,,
,702,,,"Woodpecker, ivory-billed (Campephilus principalis) - Entire",,,E,,,"$35,371",,,"1,155,872,216",
703.0,"Stickseed, showy (Hackelia venusta)",E,"$34,946","$1,155,907,162",,,,,,,,,,
,704,,,"Rattlesnake, New Mexican ridge-nosed (Crotalus willardi obscurus)",,,T,,,"$34,530",,,"1,155,941,692",
705.0,Diellia mannii (=Sci name),E,"$34,500","$1,155,976,192",,,,,,,,,,
,706,,,"Larkspur, yellow (Delphinium luteum)",,,E,,,"$34,488",,,"1,156,010,680",
707.0,"Rock-cress, shale barren (Arabis serotina)",E,"$34,200","$1,156,044,880",,,,,,,,,,
,708,,,"Chub, Hutton tui (Gila bicolor ssp.) - Hutton",,,T,,,"$34,100",,,"1,156,078,980",
709.0,"Clover, showy Indian (Trifolium amoenum)",E,"$33,992","$1,156,112,972",,,,,,,,,,
,710,,,`Oha wai (Clermontia peleana),,,E,,,"$33,832",,,"1,156,146,804",
711.0,"Fiddleneck, large-flowered (Amsinckia grandiflora)",E,"$33,671","$1,156,180,475",,,,,,,,,,
,712,,,"Spider, spruce-fir moss (Microhexura montivaga)",,,E,,,"$33,600",,,"1,156,214,075",
713.0,"Beauty, Harper's (Harperocallis flava)",E,"$33,534","$1,156,247,609",,,,,,,,,,
,714,,,"Bear-poppy, Dwarf (Arctomecon humilis)",,,E,,,"$33,400",,,"1,156,281,009",
715.0,"Beargrass, Britton's (Nolina brittoniana)",E,"$33,390","$1,156,314,399",,,,,,,,,,
,716,,,"Bird's-beak, salt marsh (Cordylanthus maritimus ssp. maritimus)",,,E,,,"$33,351",,,"1,156,347,750",
717.0,"Rock-cress, McDonald's (Arabis macdonaldiana)",E,"$33,200","$1,156,380,950",,,,,,,,,,
,718,,,Phyllostegia warshaueri (=Sci name),,,E,,,"$33,110",,,"1,156,414,060",
719.0,"Boa, Virgin Islands tree (Epicrates monensis granti)",E,"$32,500","$1,156,446,560",,,,,,,,,,
,720,,,"Morning-glory, Stebbins' (Calystegia stebbinsii)",,,E,,,"$32,494",,,"1,156,479,054",
721.0,"Darter, goldline (Percina aurolineata)",T,"$32,478","$1,156,511,532",,,,,,,,,,
,722,,,"`Akoko, Ewa Plains (Chamaesyce skottsbergii var. kalaeloana)",,,E,,,"$32,133",,,"1,156,543,665",
723.0,"Shrimp, Alabama cave (Palaemonias alabamae)",E,"$32,106","$1,156,575,771",,,,,,,,,,
,724,,,"Diellia, asplenium-leaved (Diellia erecta)",,,E,,,"$31,806",,,"1,156,607,577",
725.0,"Bat, Mexican long-nosed (Leptonycteris nivalis)",E,"$31,800","$1,156,639,377",,,,,,,,,,
,726,,,"Larkspur, Baker's (Delphinium bakeri)",,,E,,,"$31,794",,,"1,156,671,171",
727.0,"Lupine, Nipomo Mesa (Lupinus nipomensis)",E,"$31,619","$1,156,702,790",,,,,,,,,,
,728,,,"Butterfly, Uncompahgre fritillary (Boloria acrocnema)",,,E,,,"$31,551",,,"1,156,734,341",
729.0,"Twinpod, Dudley Bluffs (Physaria obcordata)",T,"$31,451","$1,156,765,792",,,,,,,,,,
,730,,,"Phlox, Yreka (Phlox hirsuta)",,,E,,,"$31,200",,,"1,156,796,992",
,731,,,"Manaca, palma de (Calyptronoma rivalis)",,,T,,,"$31,000",,,"1,156,827,992",
732.0,"Iris, dwarf lake (Iris lacustris)",T,"$30,800","$1,156,858,792",,,,,,,,,,
,733,,,"Kidneyshell, triangular (Ptychobranchus greenii)",,,E,,,"$30,686",,,"1,156,889,478",
734.0,"Dace, Kendall Warm Springs (Rhinichthys osculus thermalis)",E,"$30,600","$1,156,920,078",,,,,,,,,,
,735,,,"Pitcher-plant, green (Sarracenia oreophila)",,,E,,,"$30,353",,,"1,156,950,431",
736.0,Alani (Melicope mucronulata),E,"$30,151","$1,156,980,582",,,,,,,,,,
,737,,,"Chub, spotfin (Erimonax monachus) - Shoal Creek",,,EXPN,,,"$30,000",,,"1,157,010,582",
738.0,"Deer, key (Odocoileus virginianus clavium)",E,"$29,916","$1,157,040,498",,,,,,,,,,
,739,,,"Pigtoe, southern (Pleurobema georgianum)",,,E,,,"$29,819",,,"1,157,070,317",
740.0,"Spineflower, Robust (incl. Scotts Valley) (Chorizanthe robusta (incl. vars. robusta andhartwegii))",E,"$29,590","$1,157,099,907",,,,,,,,,,
,741,,,"Malacothrix, island (Malacothrix squalida)",,,E,,,"$29,464",,,"1,157,129,371",
742.0,"Turtle, ringed map (Graptemys oculifera)",T,"$29,300","$1,157,158,671",,,,,,,,,,
,743,,,"Bonamia, Florida (Bonamia grandiflora)",,,T,,,"$29,290",,,"1,157,187,961",
744.0,Nohoanu (Geranium kauaiense),E,"$29,198","$1,157,217,159",,,,,,,,,,
,745,,,"Mint, scrub (Dicerandra frutescens)",,,E,,,"$29,084",,,"1,157,246,243",
746.0,"Darter, relict (Etheostoma chienense)",E,"$29,000","$1,157,275,243",,,,,,,,,,
,747,,,"Joint-vetch, sensitive (Aeschynomene virginica)",,,T,,,"$28,868",,,"1,157,304,111",
748.0,"Malacothrix, Santa Cruz Island (Malacothrix indecora)",E,"$28,639","$1,157,332,750",,,,,,,,,,
,749,,,"wild buckwheat, clay-loving (Eriogonum pelinophilum)",,,E,,,"$28,472",,,"1,157,361,222",
750.0,"Rocksnail, painted (Leptoxis taeniata)",T,"$28,220","$1,157,389,442",,,,,,,,,,
,751,,,"Grass, Tennessee yellow-eyed (Xyris tennesseensis)",,,E,,,"$28,213",,,"1,157,417,655",
752.0,"Sneezeweed, Virginia (Helenium virginicum)",T,"$27,800","$1,157,445,455",,,,,,,,,,
,753,,,"Dogweed, ashy (Thymophylla tephroleuca)",,,E,,,"$27,721",,,"1,157,473,176",
754.0,"Gerardia, sandplain (Agalinis acuta)",E,"$27,683","$1,157,500,859",,,,,,,,,,
,755,,,"Mucket, orangenacre (Lampsilis perovalis)",,,T,,,"$27,555",,,"1,157,528,414",
756.0,"Liveforever, Laguna Beach (Dudleya stolonifera)",T,"$27,161","$1,157,555,575",,,,,,,,,,
,757,,,"Monkeyface, Appalachian (pearlymussel) (Quadrula sparsa)",,,E,,,"$27,133",,,"1,157,582,708",
758.0,"Falcon, northern aplomado (Falco femoralis septentrionalis) - Southwestern population",EXPN,"$27,000","$1,157,609,708",,,,,,,,,,
,759,,,`Oha wai (Clermontia drepanomorpha),,,E,,,"$26,974",,,"1,157,636,682",
760.0,"Rosemary, short-leaved (Conradina brevifolia)",E,"$26,950","$1,157,663,632",,,,,,,,,,
,761,,,"Lead-plant, Crenulate (Amorpha crenulata)",,,E,,,"$26,934",,,"1,157,690,566",
762.0,"Darter, snail (Percina tanasi)",T,"$26,708","$1,157,717,274",,,,,,,,,,
,763,,,"Ground-plum, Guthrie's (=Pyne's) (Astragalus bibullatus)",,,E,,,"$26,616",,,"1,157,743,890",
764.0,"Bladderpod, Spring Creek (Lesquerella perforata)",E,"$26,423","$1,157,770,313",,,,,,,,,,
,765,,,"Moth, Kern primrose sphinx (Euproserpinus euterpe)",,,T,,,"$26,387",,,"1,157,796,700",
766.0,Haha (Cyanea shipmanii),E,"$26,325","$1,157,823,025",,,,,,,,,,
,767,,,"Shiner, palezone (Notropis albizonatus)",,,E,,,"$26,297",,,"1,157,849,322",
768.0,"Snake, Atlantic salt marsh (Nerodia clarkii taeniata)",T,"$26,250","$1,157,875,572",,,,,,,,,,
,769,,,"Milk-vetch, Ash meadows (Astragalus phoenix)",,,T,,,"$26,003",,,"1,157,901,575",
770.0,"Iguana, Mona ground (Cyclura cornuta stejnegeri)",T,"$26,000","$1,157,927,575",,,,,,,,,,
,770,,,"Marstonia, royal (snail) (Pyrgulopsis ogmorhaphe)",,,E,,,"$26,000",,,"1,157,953,575",
771.0,"Phacelia, North Park (Phacelia formosula)",E,"$25,849","$1,157,979,424",,,,,,,,,,
,772,,,"Crayfish, Shasta (Pacifastacus fortis)",,,E,,,"$25,820",,,"1,158,005,244",
773.0,Phyllostegia parviflora (=Sci name),E,"$25,746","$1,158,030,990",,,,,,,,,,
,774,,,"Snake, Concho water (Nerodia paucimaculata)",,,T,,,"$25,700",,,"1,158,056,690",
775.0,"Towhee, Inyo California (Pipilo crissalis eremophilus)",T,"$25,470","$1,158,082,160",,,,,,,,,,
,776,,,"Milk-vetch, Ventura Marsh (Astragalus pycnostachyus var. lanosissimus)",,,E,,,"$25,251",,,"1,158,107,411",
777.0,Achyranthes mutica (=Sci name),E,"$25,224","$1,158,132,635",,,,,,,,,,
,778,,,"Mesa-mint, Otay (Pogogyne nudiuscula)",,,E,,,"$25,198",,,"1,158,157,833",
779.0,"Pigtoe, shiny (Fusconaia cor) - Entire ; Except where EXPN",E,"$25,020","$1,158,182,853",,,,,,,,,,
,779,,,"Pitcher-plant, Alabama canebrake (Sarracenia rubra alabamensis)",,,E,,,"$25,020",,,"1,158,207,873",
780.0,Ohai (Sesbania tomentosa),E,"$24,723","$1,158,232,596",,,,,,,,,,
,781,,,Alani (Melicope zahlbruckneri),,,E,,,"$24,689",,,"1,158,257,285",
782.0,`Oha wai (Clermontia pyrularia),E,"$24,687","$1,158,281,972",,,,,,,,,,
,783,,,"Snail, Stock Island tree (Orthalicus reses (not incl. nesodryas))",,,T,,,"$24,625",,,"1,158,306,597",
784.0,"Mint, Garrett's (Dicerandra christmanii)",E,"$24,250","$1,158,330,847",,,,,,,,,,
,785,,,"Centaury, spring-loving (Centaurium namophilum)",,,T,,,"$24,194",,,"1,158,355,041",
785.0,"Ivesia, Ash Meadows (Ivesia kingii var. eremica)",T,"$24,194","$1,158,379,235",,,,,,,,,,
,,,,,,,,,,Total,Total,,,
786.0,"Turtle, bog (=Muhlenberg) (Clemmys muhlenbergii) - southern",SAT,"$24,126","$1,158,403,361",,,,,,,,,,
,787,,,"Bedstraw, island (Galium buxifolium)",,,E,,,"$23,872",,,"1,158,427,233",
788.0,Haha (Cyanea stictophylla),E,"$23,755","$1,158,450,988",,,,,,,,,,
,789,,,"Damselfly, flying earwig Hawaiian (Megalagrion nesiotes)",,,E,,,"$23,754",,,"1,158,474,742",
789.0,"Damselfly, Pacific Hawaiian (Megalagrion pacificum)",E,"$23,754","$1,158,498,496",,,,,,,,,,
,790,,,"Spineflower, Monterey (Chorizanthe pungens var. pungens)",,,T,,,"$23,657",,,"1,158,522,153",
791.0,"Plum, scrub (Prunus geniculata)",E,"$23,560","$1,158,545,713",,,,,,,,,,
,792,,,"Crayfish, Nashville (Orconectes shoupi)",,,E,,,"$23,213",,,"1,158,568,926",
793.0,Heau (Exocarpos luteolus),E,"$23,000","$1,158,591,926",,,,,,,,,,
,794,,,"Beardtongue, Penland (Penstemon penlandii)",,,E,,,"$22,908",,,"1,158,614,834",
795.0,"cactus, Pariette (Sclerocactus brevispinus)",T,"$22,600","$1,158,637,434",,,,,,,,,,
,796,,,"Acornshell, southern (Epioblasma othcaloogensis)",,,E,,,"$22,537",,,"1,158,659,971",
797.0,"Naucorid, Ash Meadows (Ambrysus amargosus)",T,"$21,716","$1,158,681,687",,,,,,,,,,
,798,,,"Crownbeard, big-leaved (Verbesina dissita)",,,T,,,"$21,634",,,"1,158,703,321",
799.0,"Butterfly, Schaus swallowtail (Heraclides aristodemus ponceanus)",E,"$21,583","$1,158,724,904",,,,,,,,,,
,800,,,"Squirrel, Delmarva Peninsula fox (Sciurus niger cinereus) - DE, Sussex Co.",,,EXPN,,,"$21,561",,,"1,158,746,465",
801.0,"Butterfly, San Bruno elfin (Callophrys mossii bayensis)",E,"$21,424","$1,158,767,889",,,,,,,,,,
,802,,,"Bluegrass, Napa (Poa napensis)",,,E,,,"$21,292",,,"1,158,789,181",
803.0,"Spider, Government Canyon Bat Cave (Neoleptoneta microps)",E,"$21,260","$1,158,810,441",,,,,,,,,,
,804,,,`Anunu (Sicyos alba),,,E,,,"$21,254",,,"1,158,831,695",
805.0,"Coneflower, Tennessee purple (Echinacea tennesseensis)",E,"$21,110","$1,158,852,805",,,,,,,,,,
,806,,,"Lizard, St. Croix ground (Ameiva polops)",,,E,,,"$21,100",,,"1,158,873,905",
807.0,"Milk-vetch, Braunton's (Astragalus brauntonii)",E,"$20,960","$1,158,894,865",,,,,,,,,,
,808,,,"Gumplant, Ash Meadows (Grindelia fraxino-pratensis)",,,T,,,"$20,954",,,"1,158,915,819",
809.0,"Snail, Iowa Pleistocene (Discus macclintocki)",E,"$20,800","$1,158,936,619",,,,,,,,,,
,810,,,"Combshell, upland (Epioblasma metastriata)",,,E,,,"$20,672",,,"1,158,957,291",
811.0,"Frankenia, Johnston's (Frankenia johnstonii)",E,"$20,621","$1,158,977,912",,,,,,,,,,
,812,,,"Daisy, Parish's (Erigeron parishii)",,,T,,,"$20,620",,,"1,158,998,532",
813.0,"Ceanothus, coyote (Ceanothus ferrisae)",E,"$20,567","$1,159,019,099",,,,,,,,,,
,814,,,Haha (Cyanea hamatiflora ssp. carlsonii),,,E,,,"$20,524",,,"1,159,039,623",
815.0,"Ipomopsis, Holy Ghost (Ipomopsis sancti-spiritus)",E,"$20,500","$1,159,060,123",,,,,,,,,,
,816,,,"Grass, Eureka Dune (Swallenia alexandrae)",,,E,,,"$20,484",,,"1,159,080,607",
817.0,"Gooseberry, Miccosukee (Ribes echinellum)",T,"$20,100","$1,159,100,707",,,,,,,,,,
,817,,,"Milkpea, Small's (Galactia smallii)",,,E,,,"$20,100",,,"1,159,120,807",
818.0,"Goldenrod, Houghton's (Solidago houghtonii)",T,"$20,062","$1,159,140,869",,,,,,,,,,
,819,,,"Goldenrod, white-haired (Solidago albopilosa)",,,T,,,"$20,000",,,"1,159,160,869",
820.0,"Liveforever, Santa Barbara Island (Dudleya traskiae)",E,"$19,851","$1,159,180,720",,,,,,,,,,
,821,,,"Geranium, Hawaiian red-flowered (Geranium arboreum)",,,E,,,"$19,651",,,"1,159,200,371",
822.0,"Pupfish, Warm Springs (Cyprinodon nevadensis pectoralis)",E,"$19,598","$1,159,219,969",,,,,,,,,,
,823,,,Palo de rosa (Ottoschulzia rhodoxylon),,,E,,,"$19,558",,,"1,159,239,527",
824.0,"Fringe-tree, pygmy (Chionanthus pygmaeus)",E,"$19,556","$1,159,259,083",,,,,,,,,,
,825,,,"Dace, Ash Meadows speckled (Rhinichthys osculus nevadensis)",,,E,,,"$19,422",,,"1,159,278,505",
826.0,"Allocarya, Calistoga (Plagiobothrys strictus)",E,"$19,342","$1,159,297,847",,,,,,,,,,
,827,,,"Milkweed, Welsh's (Asclepias welshii)",,,T,,,"$19,100",,,"1,159,316,947",
828.0,"Madtom, yellowfin (Noturus flavipinnis) - Holston River, VA, TN",EXPN,"$19,000","$1,159,335,947",,,,,,,,,,
,829,,,"Spurge, telephus (Euphorbia telephioides)",,,T,,,"$18,867",,,"1,159,354,814",
830.0,"Dudleya, Santa Clara Valley (Dudleya setchellii)",E,"$18,847","$1,159,373,661",,,,,,,,,,
,831,,,"Silverside, Waccamaw (Menidia extensa)",,,T,,,"$18,824",,,"1,159,392,485",
832.0,"Vole, Hualapai Mexican (Microtus mexicanus hualpaiensis)",E,"$18,765","$1,159,411,250",,,,,,,,,,
,833,,,A`e (Zanthoxylum dipetalum var. tomentosum),,,E,,,"$18,650",,,"1,159,429,900",
834.0,"Cactus, Knowlton's (Pediocactus knowltonii)",E,"$18,631","$1,159,448,531",,,,,,,,,,
,835,,,"Elimia, lacy (snail) (Elimia crenatella)",,,T,,,"$18,504",,,"1,159,467,035",
836.0,"Rocksnail, plicate (Leptoxis plicata)",E,"$18,378","$1,159,485,413",,,,,,,,,,
,837,,,"Milk-vetch, Osterhout (Astragalus osterhoutii)",,,E,,,"$18,231",,,"1,159,503,644",
838.0,"Buckwheat, Ione (incl. Irish Hill) (Eriogonum apricum (incl. var. prostratum))",E,"$18,226","$1,159,521,870",,,,,,,,,,
,839,,,"Manzanita, Presidio (Arctostaphylos hookeri var. ravenii)",,,E,,,"$18,219",,,"1,159,540,089",
840.0,"Buckwheat, steamboat (Eriogonum ovalifolium var. williamsiae)",E,"$18,197","$1,159,558,286",,,,,,,,,,
,841,,,"Dudleyea, Santa Monica Mountains (Dudleya cymosa ssp. ovatifolia)",,,T,,,"$18,157",,,"1,159,576,443",
842.0,"Moccasinshell, Coosa (Medionidus parvulus)",E,"$18,095","$1,159,594,538",,,,,,,,,,
,,,,,,,,,,Total,Total,,,
843,"Gambusia, Pecos (Gambusia nobilis)",E,"$17,900","$1,159,612,438",,,,,,,,,,
,844,,,Plymouth Red-Bellied Turtle (Pseudemys rubriventris bangsi),,,E,,,"$17,800",,,"1,159,630,238",
845,"Checkermallow, Wenatchee Mountains (Sidalcea oregana var. calva)",E,"$17,789","$1,159,648,027",,,,,,,,,,
,846,,,"Butterfly, Myrtle's silverspot (Speyeria zerene myrtleae)",,,E,,,"$17,735",,,"1,159,665,762",
847,"Potentilla, Hickman's (Potentilla hickmanii)",E,"$17,663","$1,159,683,425",,,,,,,,,,
,848,,,"Goldenrod, Short's (Solidago shortii)",,,E,,,"$17,600",,,"1,159,701,025",
848,Schiedea haleakalensis (=Sci name),E,"$17,600","$1,159,718,625",,,,,,,,,,
,849,,,"Rattleweed, hairy (Baptisia arachnifera)",,,E,,,"$17,500",,,"1,159,736,125",
850,"Locoweed, Fassett's (Oxytropis campestris var. chartacea)",T,"$17,400","$1,159,753,525",,,,,,,,,,
,851,,,"Polygonum, Scotts Valley (Polygonum hickmanii)",,,E,,,"$17,361",,,"1,159,770,886",
852,"Fleabane, Zuni (Erigeron rhizomatus)",T,"$17,150","$1,159,788,036",,,,,,,,,,
,853,,,"Pitcher-plant, mountain sweet (Sarracenia rubra ssp. jonesii)",,,E,,,"$17,140",,,"1,159,805,176",
854,"Bladderpod, Zapata (Lesquerella thamnophila)",E,"$17,021","$1,159,822,197",,,,,,,,,,
855,855,,"Pigtoe, rough (Pleurobema plenum) - TN - portions of the French Broad and Holston",,EXPN,EXPN,"$17,000","$17,000","$1,159,839,197","1,159,839,197",,,,
,,,,Rivers,,,,,,,,,,
856,"Alopecurus, Sonoma (Alopecurus aequalis var. sonomensis)",E,"$16,985","$1,159,856,182",,,,,,,,,,
,857,,,"Blazingstar, Ash Meadows (Mentzelia leucophylla)",,,T,,,"$16,954",,,"1,159,873,136",
857,"Sunray, Ash Meadows (Enceliopsis nudicaulis var. corrugata)",T,"$16,954","$1,159,890,090",,,,,,,,,,
,858,,,"Cycladenia, Jones (Cycladenia jonesii (=humilis))",,,T,,,"$16,800",,,"1,159,906,890",
859,"Pentachaeta, white-rayed (Pentachaeta bellidiflora)",E,"$16,789","$1,159,923,679",,,,,,,,,,
,860,,,"Irisette, white (Sisyrinchium dichotomum)",,,E,,,"$16,228",,,"1,159,939,907",
861,"Meadowrue, Cooley's (Thalictrum cooleyi)",E,"$16,084","$1,159,955,991",,,,,,,,,,
,862,,,"Pinkroot, gentian (Spigelia gentianoides)",,,E,,,"$16,001",,,"1,159,971,992",
863,"Bladderpod, white (Lesquerella pallida)",E,"$16,000","$1,159,987,992",,,,,,,,,,
,864,,,"Heelsplitter, Alabama (=inflated) (Potamilus inflatus)",,,T,,,"$15,956",,,"1,160,003,948",
865,"Amphianthus, little (Amphianthus pusillus)",T,"$15,880","$1,160,019,828",,,,,,,,,,
,866,,,Lau `ehu (Panicum niihauense),,,E,,,"$15,847",,,"1,160,035,675",
867,Asplenium fragile var. insulare (=Sci name),E,"$15,800","$1,160,051,475",,,,,,,,,,
,868,,,"Spider, Tooth Cave (Leptoneta myopica)",,,E,,,"$15,600",,,"1,160,067,075",
869,Platanthera holochila (=Sci name),E,"$15,579","$1,160,082,654",,,,,,,,,,
,870,,,"Darter, Maryland (Etheostoma sellare)",,,E,,,"$15,497",,,"1,160,098,151",
871,"Prickly-apple, fragrant (Cereus eriophorus var. fragrans)",E,"$15,350","$1,160,113,501",,,,,,,,,,
,872,,,"Darter, watercress (Etheostoma nuchale)",,,E,,,"$15,309",,,"1,160,128,810",
873,"Polygala, tiny (Polygala smallii)",E,"$15,100","$1,160,143,910",,,,,,,,,,
,874,,,"Orcutt grass, San Joaquin (Orcuttia inaequalis)",,,T,,,"$14,949",,,"1,160,158,859",
875,"Pearlymussel, birdwing (Conradilla caelata) - TN - portions of the French Broad andHolston Rivers",EXPN,"$14,849","$1,160,173,708",,,,,,,,,,
,876,,,"Brodiaea, Chinese Camp (Brodiaea pallida)",,,T,,,"$14,567",,,"1,160,188,275",
877,Kuawawaenohu (Alsinidendron lychnoides),E,"$14,500","$1,160,202,775",,,,,,,,,,
,878,,,"Vole, Amargosa (Microtus californicus scirpensis)",,,E,,,"$14,340",,,"1,160,217,115",
879,Hau kuahiwi (Hibiscadelphus giffardianus),E,"$14,324","$1,160,231,439",,,,,,,,,,
,880,,,"Lichen, rock gnome (Gymnoderma lineare)",,,E,,,"$14,314",,,"1,160,245,753",
881,"Gilia, Monterey (Gilia tenuiflora ssp. arenaria)",E,"$14,309","$1,160,260,062",,,,,,,,,,
,882,,,Hau kuahiwi (Hibiscadelphus hualalaiensis),,,E,,,"$14,274",,,"1,160,274,336",
883,Rice rat (Oryzomys palustris natator) - lower FL Keys,E,"$14,083","$1,160,288,419",,,,,,,,,,
,884,,,"Grasshopper, Zayante band-winged (Trimerotropis infantilis)",,,E,,,"$14,049",,,"1,160,302,468",
885,"Lupine, clover (Lupinus tidestromii)",E,"$13,839","$1,160,316,307",,,,,,,,,,
,886,,,"Campion, fringed (Silene polypetala)",,,E,,,"$13,800",,,"1,160,330,107",
887,"Chub, slender (Erimystax cahni)",T,"$13,700","$1,160,343,807",,,,,,,,,,
,888,,,"Milk-vetch, Fish Slough (Astragalus lentiginosus var. piscinensis)",,,T,,,"$13,661",,,"1,160,357,468",
889,"Mustard, Carter's (Warea carteri)",E,"$13,656","$1,160,371,124",,,,,,,,,,
,890,,,"Pseudoscorpion, Tooth Cave (Tartarocreagris texana)",,,E,,,"$13,600",,,"1,160,384,724",
890,"Meshweaver, Robber Baron Cave (Cicurina baronia)",E,"$13,600","$1,160,398,324",,,,,,,,,,
,891,,,Kiponapona (Phyllostegia racemosa),,,E,,,"$13,563",,,"1,160,411,887",
892,"Meshweaver, Government Canyon Bat Cave (Cicurina vespera)",E,"$13,260","$1,160,425,147",,,,,,,,,,
,893,,,"Sand-verbena, large-fruited (Abronia macrocarpa)",,,E,,,"$13,250",,,"1,160,438,397",
894,"Primrose, Maguire (Primula maguirei)",T,"$13,227","$1,160,451,624",,,,,,,,,,
,895,,,"Sunflower, San Mateo woolly (Eriophyllum latilobum)",,,E,,,"$13,177",,,"1,160,464,801",
896,"Bellflower, Brooksville (Campanula robinsiae)",E,"$13,056","$1,160,477,857",,,,,,,,,,
855,855,,,,,,,,,,,,,
EXPN,EXPN,,,,,,,,,,,,,
"$17,000","$17,000",,,,,,,,,,,,,
"$1,159,839,197","1,159,839,197",,,,,,,,,,,,,
,,,,,,,,,,Total,Total,,,
897.0,"Avens, spreading (Geum radiatum)",E,"$13,002","$1,160,490,859",,,,,,,,,,
,898,,,Guajon (Eleutherodactylus cooki),,,T,,,"$13,000",,,"1,160,503,859",
898.0,"Harvestman, Cokendolpher Cave (Texella cokendolpheri)",E,"$13,000","$1,160,516,859",,,,,,,,,,
,899,,,"Grass, Solano (Tuctoria mucronata)",,,E,,,"$12,841",,,"1,160,529,700",
900.0,"Mallow, Peter's Mountain (Iliamna corei)",E,"$12,678","$1,160,542,378",,,,,,,,,,
,901,,,"Chaff-flower, round-leaved (Achyranthes splendens var. rotundata)",,,E,,,"$12,633",,,"1,160,555,011",
902.0,"Pentachaeta, Lyon's (Pentachaeta lyonii)",E,"$12,602","$1,160,567,613",,,,,,,,,,
,903,,,"Mint, Lakela's (Dicerandra immaculata)",,,E,,,"$12,600",,,"1,160,580,213",
904.0,"Dudleya, marcescent (Dudleya cymosa ssp. marcescens)",T,"$12,473","$1,160,592,686",,,,,,,,,,
,905,,,"Butterwort, Godfrey's (Pinguicula ionantha)",,,T,,,"$12,383",,,"1,160,605,069",
906.0,"Quillwort, black spored (Isoetes melanospora)",E,"$12,260","$1,160,617,329",,,,,,,,,,
,907,,,Phyllostegia mannii (=Sci name),,,E,,,"$12,137",,,"1,160,629,466",
908.0,"Clarkia, Springville (Clarkia springvillensis)",T,"$12,059","$1,160,641,525",,,,,,,,,,
,909,,,"Chumbo, Higo (Harrisia portoricensis)",,,T,,,"$12,000",,,"1,160,653,525",
910.0,Pa`iniu (Astelia waialealae),E,"$11,985","$1,160,665,510",,,,,,,,,,
,911,,,Alani (Melicope degeneri),,,E,,,"$11,912",,,"1,160,677,422",
912.0,"Rocksnail, round (Leptoxis ampla)",T,"$11,878","$1,160,689,300",,,,,,,,,,
,913,,,"Gourd, Okeechobee (Cucurbita okeechobeensis ssp. okeechobeensis)",,,E,,,"$11,664",,,"1,160,700,964",
914.0,"Milk-vetch, Mancos (Astragalus humillimus)",E,"$11,631","$1,160,712,595",,,,,,,,,,
,915,,,"Checker-mallow, Keck's (Sidalcea keckii)",,,E,,,"$11,609",,,"1,160,724,204",
916.0,"Pikeminnow (=squawfish), Colorado (Ptychocheilus lucius) - Salt and Verde R.drainages, AZ",EXPN,"$11,523","$1,160,735,727",,,,,,,,,,
,917,,,"Boxwood, Vahl's (Buxus vahlii)",,,E,,,"$11,500",,,"1,160,747,227",
918.0,"Crayfish, cave (Cambarus aculabrum)",E,"$11,487","$1,160,758,714",,,,,,,,,,
,919,,,"Lioplax, cylindrical (snail) (Lioplax cyclostomaformis)",,,E,,,"$11,478",,,"1,160,770,192",
920.0,"Honeycreeper, crested (Palmeria dolei)",E,"$11,362","$1,160,781,554",,,,,,,,,,
,921,,,"Onion, Munz's (Allium munzii)",,,E,,,"$11,332",,,"1,160,792,886",
922.0,"Daisy, lakeside (Hymenoxys herbacea)",T,"$11,331","$1,160,804,217",,,,,,,,,,
,923,,,"Warea, wide-leaf (Warea amplexifolia)",,,E,,,"$11,256",,,"1,160,815,473",
